{
  "vuls_version": "0.2.0",
  "record_type": "observation",
  "record_id": "weight-2026-02-01",
  "subject_id": "synthetic-dog-001",
  "study_id": "dog-aging-001",
  "observation": {
    "concept": "body_weight",
    "value": 28.8,
    "unit": "kg",
    "observed_at": "2026-02-01T09:00:00Z",
    "entered_at": "2026-02-03T11:00:00Z"
  },
  "method": {
    "method_type": "direct_measurement",
    "method_name": "Electronic scale",
    "instrument": "example-scale-a"
  },
  "provenance": {
    "source_type": "research_collected",
    "source_name": "Synthetic demonstration dataset"
  },
  "quality": {
    "status": "unverified",
    "completeness": "complete",
    "flags": [
      "synthetic_example"
    ]
  },
  "permission": {
    "publication_status": "open",
    "permitted_uses": [
      "research"
    ],
    "licence": "CC0-1.0"
  },
  "revision": {
    "revision_id": "rev-weight-3",
    "revision_number": 3,
    "revision_type": "correction",
    "previous_revision_id": "rev-weight-2",
    "revision_reason": "Recorded the scale identifier",
    "revision_status": "current",
    "created_at": "2026-02-03T11:00:00Z",
    "created_by": "editor-001"
  }
}
