{
  "vuls_version": "0.2.0",
  "record_type": "observation",
  "record_id": "bcs-with-system",
  "subject_id": "synthetic-dog-001",
  "study_id": "dog-aging-001",
  "observation": {
    "concept": "body_condition_score",
    "value": 5,
    "observed_at": "2026-10-01T09:00:00Z",
    "unit": "score_1_9",
    "scoring_system": "example_1_to_9"
  },
  "method": {
    "method_type": "owner_reported",
    "method_name": "Owner measurement"
  },
  "provenance": {
    "source_type": "owner_reported",
    "source_name": "Synthetic demonstration dataset"
  },
  "quality": {
    "status": "unverified",
    "completeness": "complete",
    "flags": [
      "synthetic_example"
    ]
  },
  "permission": {
    "publication_status": "open",
    "permitted_uses": [
      "research"
    ],
    "licence": "CC0-1.0"
  }
}
